Date màj;Code lieu;Code station;Nom station;Code équipement;Type équipement;Equipement;Début indispo;Cause;Conséquence;Fin indispo
2024-11-26 23:44:00;5102;21;Charpennes;213;ASCENSEUR;du quai direction St-Genis-Laval Hôpital Lyon Sud, correspondance ligne A direction Perrache par le couloir de liaison, accès Place Charles Hernu.;2024-10-03;Panne;Accès direct ligne B direction Gare d'Oullins impossible. Emprunter l'ascenseur numéro 211 de la ligne A quai direction Perrache et revenir par le couloir de liaison;2024-11-29 08:30:00
2024-11-26 23:44:00;5220;47;Debourg;4702;ESCALIER;du quai direction Charpennes jusqu'à la sortie avenue Jean Jaures;2024-11-12;Panne;.;2025-01-15 21:30:00
2024-11-26 23:44:00;5520;42;Gare Part-Dieu V.Merle;4210;ESCALIER;de la sortie de la gare de la Part Dieu jusqu'à la mezzanine niveau Point Contact (par couloir de liaison);2024-10-28;Panne;.;2024-11-30 10:30:00
2024-11-26 23:44:00;5160;45;Jean Macé;4502;ESCALIER;Place Jean Macé face, à la rue Professeur Grignard;2024-09-18;Panne;.;2024-12-10 23:30:00
2024-11-26 23:44:00;5936;51;Oullins Centre;513;ASCENSEUR;entre la mezzanine supérieure et la place Anatole France;2024-11-07;Entretien programmé;connexion impossible entre la mezzanine supérieure et la place Anatole France, et correspondance impossible avec les ascenseurs reliant les quais et la mezzanine supérieure;2024-12-22 12:00:00
2024-11-26 23:44:00;5936;51;Oullins Centre;5105;ESCALIER;entre la mezzanine supérieure et la place Anatole France côté rue de la République;2024-11-26;Panne;emprunter l'autre escalier mécanique si disponible (escalier n°5107 entre la mezzanine supérieure et la place Anatole France côté rue Voltaire);2024-11-27 08:00:00
2024-11-26 23:44:00;5936;51;Oullins Centre;5107;ESCALIER;entre la mezzanine supérieure et la place Anatole France côté rue Voltaire;2024-11-26;Panne;emprunter l'autre escalier mécanique si disponible (escalier n°5105 entre la mezzanine supérieure et la place Anatole France côté rue de la République);2024-11-28 16:00:00
2024-11-26 23:44:00;5043;43;Place Guichard;431;ASCENSEUR;direction St-Genis-Laval Hôpital Lyon Sud et accès place Guichard;2024-11-26;Accès fermé pour travaux;Accès impossible direction Gare d'Oullins;2024-11-27 02:00:00
2024-11-26 23:44:00;5043;43;Place Guichard;4301;ESCALIER;du quai 1 direction St-Genis-Laval Hôpital Lyon Sud jusqu'à la sortie Bourse du Travail, rue de Créqui.;2024-11-23;Panne;.;2024-11-28 16:30:00
2024-11-26 23:44:00;5221;46;Place Jean Jaurès;461;ASCENSEUR;direction St-Genis-Laval Hôpital Lyon Sud et accès avenue Jean Jaurès;2024-11-25;Panne;Accès impossible direction Gare d'Oullins;2024-12-10 11:00:00
2024-11-26 23:44:00;5221;46;Place Jean Jaurès;4601;ESCALIER;du quai direction St-Genis-Laval Hôpital Lyon Sud jusqu'à la sortie avenue Jean Jaures;2024-10-09;Panne;.;2024-12-16 21:00:00
2024-11-26 23:44:00;5221;46;Place Jean Jaurès;4602;ESCALIER;du quai direction Charpennes jusqu'à la sortie avenue Jean Jaures;2024-11-02;Panne;.;2025-01-30 22:30:00
2024-11-26 23:44:00;5092;44;Saxe - Gambetta;4408;ESCALIER;du quai ligne B direction St-Genis-Laval Hôpital Lyon Sud (par by pass) jusqu'au quai ligne D direction Gare de Vénissieux;2024-11-26;Panne;.;2024-11-27 02:00:00
2024-11-26 23:44:00;5200;48;Stade de Gerland Le LOU;4802;ESCALIER;de la mezzanine niveau Point Contact jusqu'au quai direction Charpennes;2024-10-23;Panne;.;2025-01-30 11:30:00
2024-11-26 23:44:00;5200;48;Stade de Gerland Le LOU;4803;ESCALIER;de la mezzanine niveau Point Contact jusqu'à la sortie avenue Jean Jaurès;2024-11-04;Panne;.;2024-12-16 14:00:00
2024-11-26 23:44:00;5002;26;Bellecour;2612;ESCALIER;du quai direction Vaulx-en-Velin La Soie jusqu'à la sortie place Bellecour;2024-07-25;Panne;.;2024-12-29 14:30:00
2024-11-26 23:44:00;5103;84;Gare de Vaise;844;ASCENSEUR;direction Gare de Vénissieux, accès Gare Routière ou Parc Relais;2024-11-19;Vandalisme;.;2024-12-19 16:30:00
2024-11-26 23:44:00;5104;70;Gare de Vénissieux;7003;ESCALIER;de la mezzanine vers la passerelle SNCF;2024-11-26;Panne;.;2024-11-28 15:00:00
2024-11-26 23:44:00;5181;77;Garibaldi;7702;ESCALIER;du quai direction Gare de Vénissieux jusqu'à la mezzanine;2024-11-17;Entretien programmé;.;2024-12-15 17:00:00
2024-11-26 23:44:00;5040;82;Gorge de Loup;821;ASCENSEUR;direction Gare de Vaise, accès Gare Routière ou Parc Relais;2024-11-26;Panne;Accès impossible direction Gare de Vaise.;2024-11-27 02:00:00
2024-11-26 23:44:00;5041;74;Grange Blanche;7406;ESCALIER;de la mezzanine jusqu'à la sortie place d' Arsonval (départ bus);2024-09-06;Entretien programmé;.;2024-12-12 10:30:00
2024-11-26 23:44:00;5044;79;Guillotière Gabriel Péri;7904;ESCALIER;du quai direction Gare de Vénissieux jusqu'à la mezzanine;2024-11-25;Panne;.;2025-01-01 07:30:00
2024-11-26 23:44:00;5095;81;Vieux Lyon;8105;ESCALIER;de la mezzanine niveau Point Contact jusqu'à la mezzanine niveau -3 (correspondance ligne D direction Gare de Vaise ou Gare de Vénissieux;2024-11-26;Accès fermé pour travaux;.;2024-11-27 02:00:00
2024-11-26 23:44:00;5095;81;Vieux Lyon;8107;ESCALIER;de la mezzanine niveau -3 (correspondance ligne D direction Gare de Vaise ou Gare de Vénissieux) jusqu'à la mezzanine niveau Point Contact, accès rue du Doyenné.;2023-12-30;Panne;.;2024-12-31 22:00:00
2024-11-26 23:44:00;5045;58;Hénon;5801;ESCALIER;du quai direction Cuire jusqu'à la sortie angle rue Hénon / boulevard des Canuts;2024-11-26;Panne;.;2024-11-27 01:30:00
2024-11-26 23:44:00;5046;24;Hôtel de Ville L. Pradel;2403;ESCALIER;du quai de montée ligne C jusqu'au quai ligne A direction Vaulx-en-Velin La Soie;2024-11-26;Panne;.;2024-11-27 08:30:00
2024-11-26 23:44:00;5021;25;Cordeliers;2502;ESCALIER;du quai direction Vaulx-en-Velin La Soie jusqu'à la sortie place des Cordeliers;2024-11-26;Panne;.;2024-11-27 00:30:00
2024-11-26 23:44:00;5024;18;Flachet;1802;ESCALIER;du quai direction Vaulx-en-Velin La Soie jusqu'à la sortie cours Emile Zola;2024-11-26;Accès fermé pour travaux;.;2024-11-27 02:00:00
2024-11-26 23:44:00;5182;23;Foch;231;ASCENSEUR;direction Perrache et accès Franklin Roosevelt;2024-11-26;Entretien programmé;Accès impossible direction Perrache;2024-12-06 16:00:00
2024-11-26 23:44:00;5101;16;Laurent Bonnevay;1602;ESCALIER;de la passerelle piéton, venant de la gare routière bus, jusqu'à la mezzanine piéton;2024-11-22;Panne;.;2024-11-29 09:00:00
2024-11-26 23:44:00;5081;22;Masséna;221;ASCENSEUR;direction Perrache et accès cours Vitton;2024-11-05;Panne;Accès impossible direction Perrache;2025-01-01 12:30:00
2024-11-26 23:44:00;5080;92;Minimes Théatres Romains;923;ASCENSEUR;direction Saint-Just ou Vieux Lyon, accès rue de l'Antiquaille;2024-11-26;Panne;Accès station impossible;2024-11-30 07:30:00
