Date màj;Code lieu;Code station;Nom station;Code équipement;Type équipement;Equipement;Début indispo;Cause;Conséquence;Fin indispo
2025-01-31 06:09:00;5102;21;Charpennes;2101;ESCALIER;du quai direction Perrache ou direction St-Genis-Laval Hôpital Lyon Sud par le couloir de liaison jusqu'à la sortie Place Charles Hernu;2025-01-11;Panne;.;2025-01-31 17:30:00
2025-01-31 06:09:00;5220;47;Debourg;4701;ESCALIER;du quai direction St-Genis-Laval Hôpital Lyon Sud jusqu'à la sortie avenue Jean Jaures;2025-01-21;Panne;.;2025-04-04 17:30:00
2025-01-31 06:09:00;5220;47;Debourg;4702;ESCALIER;du quai direction Charpennes jusqu'à la sortie avenue Jean Jaures;2024-11-12;Panne;.;2025-02-07 17:30:00
2025-01-31 06:09:00;5520;42;Gare Part-Dieu V.Merle;4205;ESCALIER;du quai direction St-Genis-Laval Hôpital Lyon Sud (par couloir de liaison direction gare de la Part Dieu) jusqu'à la mezzanine niveau Point Contact.;2025-01-09;Panne;.;2025-03-21 17:30:00
2025-01-31 06:09:00;5520;42;Gare Part-Dieu V.Merle;4210;ESCALIER;de la sortie de la gare de la Part Dieu jusqu'à la mezzanine niveau Point Contact (par couloir de liaison);2025-01-30;Panne;.;2025-02-07 14:30:00
2025-01-31 06:09:00;5936;51;Oullins Centre;513;ASCENSEUR;entre la mezzanine supérieure et la place Anatole France;2024-11-07;Entretien programmé;connexion impossible entre la mezzanine supérieure et la place Anatole France, et correspondance impossible avec les ascenseurs reliant les quais et la mezzanine supérieure;2025-02-04 12:00:00
2025-01-31 06:09:00;5043;43;Place Guichard;431;ASCENSEUR;direction St-Genis-Laval Hôpital Lyon Sud et accès place Guichard;2024-12-24;Panne;Accès impossible direction Gare d'Oullins;2025-02-28 17:30:00
2025-01-31 06:09:00;5221;46;Place Jean Jaurès;4601;ESCALIER;du quai direction St-Genis-Laval Hôpital Lyon Sud jusqu'à la sortie avenue Jean Jaures;2024-10-09;Panne;.;2025-01-31 17:30:00
2025-01-31 06:09:00;5221;46;Place Jean Jaurès;4602;ESCALIER;du quai direction Charpennes jusqu'à la sortie avenue Jean Jaures;2024-11-02;Panne;.;2025-02-28 17:30:00
2025-01-31 06:09:00;5200;48;Stade de Gerland Le LOU;4802;ESCALIER;de la mezzanine niveau Point Contact jusqu'au quai direction Charpennes;2024-10-23;Panne;.;2025-03-28 17:30:00
2025-01-31 06:09:00;5002;26;Bellecour;263;ASCENSEUR;direction Gare de Vaise ou Gare de Vénissieux, correspondance Ligne A direction Perrache ou Vaulx-en-Velin La Soie;2025-01-28;Entretien programmé;Accès impossible ligne D;2025-01-31 18:00:00
2025-01-31 06:09:00;5002;26;Bellecour;264;ASCENSEUR;direction Vaulx-en-Velin La Soie, accès rue de la République;2025-01-13;Panne;Pour accès et correspondances métros A et D, utiliser les autres ascenseurs en passant par la surface;2025-02-01 14:30:00
2025-01-31 06:09:00;5104;70;Gare de Vénissieux;7003;ESCALIER;de la mezzanine vers la passerelle SNCF;2025-01-05;Panne;.;2025-02-06 11:30:00
2025-01-31 06:09:00;5181;77;Garibaldi;7703;ESCALIER;de la mezzanine jusqu'à la sortie rue Garibaldi;2025-01-31;Panne;.;2025-01-31 07:30:00
2025-01-31 06:09:00;5040;82;Gorge de Loup;821;ASCENSEUR;direction Gare de Vaise, accès Gare Routière ou Parc Relais;2025-01-02;Panne;Accès impossible direction Gare de Vaise.;2025-02-15 20:30:00
2025-01-31 06:09:00;5040;82;Gorge de Loup;8205;ESCALIER;sortie Place Basse (côté agence commerciale) niveau Parc Relais, jusqu'à la mezzanine niveau départ gare de bus, rue Sergent Michel Berthet;2024-12-12;Panne;.;2025-02-15 15:00:00
2025-01-31 06:09:00;5041;74;Grange Blanche;7402;ESCALIER;de la mezzanine côté hôpital Edouard Herriot jusqu'à la sortie Hôpital Edouard Herriot;2024-12-13;Panne;.;2025-01-31 07:30:00
2025-01-31 06:09:00;5044;79;Guillotière Gabriel Péri;793;ASCENSEUR;correspondance entre la mezzanine et la Grande rue de la Guillotière;2025-01-29;Panne; Accès station impossible;2025-01-31 08:00:00
2025-01-31 06:09:00;5044;79;Guillotière Gabriel Péri;7901;ESCALIER;de la mezzanine (côté quai direction Gare de Vaise) jusqu'à la sortie cours Gambetta;2025-01-14;Panne;.;2025-02-03 17:00:00
2025-01-31 06:09:00;5044;79;Guillotière Gabriel Péri;7902;ESCALIER;de la mezzanine (côté quai direction Gare de Vénissieux) jusqu'à la sortie cours Gambetta;2024-12-12;Entretien programmé;.;2025-02-03 15:30:00
2025-01-31 06:09:00;5084;71;Parilly;7101;ESCALIER;du quai direction Gare de Vaise jusqu'à la sortie rue de La Fontaine;2025-01-23;Panne;.;2025-02-23 15:30:00
2025-01-31 06:09:00;5091;76;Sans Souci;761;ASCENSEUR;direction Gare de Vaise, accès cours Albert Thomas;2025-01-28;Entretien programmé;Accès impossible direction Gare de Vaise.;2025-02-07 12:30:00
2025-01-31 06:09:00;5091;76;Sans Souci;7602;ESCALIER;du quai direction Gare de Vénissieux jusqu'à la sortie cours Albert Thomas;2024-12-17;Panne;.;2025-01-31 19:00:00
2025-01-31 06:09:00;5095;81;Vieux Lyon;8107;ESCALIER;de la mezzanine niveau -3 (correspondance ligne D direction Gare de Vaise ou Gare de Vénissieux) jusqu'à la mezzanine niveau Point Contact, accès rue du Doyenné.;2024-12-07;Panne;.;2025-02-28 15:00:00
2025-01-31 06:09:00;5906;97;Manufacture Montluc;971;ASCENSEUR;Liaison entre les quais d'arrivée et de départ;2025-01-30;Vandalisme;Liaison impossible;2025-01-31 14:30:00
2025-01-31 06:09:00;5000;27;Ampère Victor Hugo;2702;ESCALIER;du quai direction Vaulx-en-Velin La Soie  jusqu'à la sortie rue Victor HUGO;2025-01-24;Panne;.;2025-01-31 14:30:00
2025-01-31 06:09:00;5023;17;Cusset;171;ASCENSEUR;direction Perrache, accès mezzanine de correspondance direction Vaulx-en-Velin La Soie, accès cours Emile Zola;2025-01-30;Panne;Accès impossible direction Perrache.  Accès impossible cours Emile Zola .;2025-01-31 14:30:00
2025-01-31 06:09:00;5024;18;Flachet;181;ASCENSEUR;direction Perrache, accès cours Emile Zola;2025-01-30;Panne;Accès impossible direction Perrache;2025-01-31 14:30:00
2025-01-31 06:09:00;5024;18;Flachet;1802;ESCALIER;du quai direction Vaulx-en-Velin La Soie jusqu'à la sortie cours Emile Zola;2025-01-30;Panne;.;2025-02-10 17:30:00
2025-01-31 06:09:00;5182;23;Foch;2302;ESCALIER;du quai  direction Vaulx-en-Velin La Soie  jusqu'à la sortie angle cours Franklin Roosevelt / avenue du Maréchal de Saxe;2025-01-26;Panne;.;2025-01-31 21:30:00
2025-01-31 06:09:00;5042;19;Gratte Ciel;191;ASCENSEUR;du quai direction Perrache, accès cours Emile Zola;2025-01-31;Accès fermé pour travaux;Accès impossible direction Perrache;2025-01-31 07:00:00
2025-01-31 06:09:00;5042;19;Gratte Ciel;192;ASCENSEUR;du quai direction Vaulx-en-Velin La Soie, accès cours Emile Zola;2025-01-30;Panne;Accès impossible direction Vaulx-en-Velin La Soie;2025-01-31 14:30:00
2025-01-31 06:09:00;5101;16;Laurent Bonnevay;169;ASCENSEUR;Parc Relais;2025-01-31;Entretien programmé;Accès aux différents niveaux impossible;2025-01-31 06:30:00
2025-01-31 06:09:00;5224;91;Fourvière;911;ASCENSEUR;direction Vieux Lyon, accès Basilique;2025-01-31;Panne;Accès station impossible.;2025-01-31 08:00:00
