id;date_maj;code_lieu;code_station;nom_station;code_equipement;type_equipement;equipement;debut_indispo;cause;consequence;fin_indispo;gid;last_update_fme
1;2025-05-12 08:54:00;5004;41;Brotteaux;411;ASCENSEUR;direction St-Genis-Laval Hôpital Lyon Sud, accès mezzanine de correspondance avec le quai direction Charpennes;2025-05-12 00:00:00;Entretien programmé;Accès impossible direction Gare d'Oullins;2025-05-12 12:30:00;12408662;2025-05-12 08:55:02
2;2025-05-12 08:54:00;5004;41;Brotteaux;4101;ESCALIER;de la mezzanine jusqu'à la sortie Gare des Brotteaux;2025-04-22 00:00:00;Panne;.;2025-05-16 17:30:00;12408663;2025-05-12 08:55:02
3;2025-05-12 08:54:00;5102;21;Charpennes;2101;ESCALIER;du quai direction Perrache ou direction St-Genis-Laval Hôpital Lyon Sud par le couloir de liaison jusqu'à la sortie Place Charles Hernu;2025-05-11 00:00:00;Panne;.;2025-05-17 17:30:00;12408664;2025-05-12 08:55:02
4;2025-05-12 08:54:00;5102;21;Charpennes;2103;ESCALIER;du quai direction St-Genis-Laval Hôpital Lyon Sud jusqu'à la place Charles Hernu;2025-04-10 00:00:00;Panne;.;2025-06-15 17:30:00;12408665;2025-05-12 08:55:02
5;2025-05-12 08:54:00;5220;47;Debourg;4701;ESCALIER;du quai direction St-Genis-Laval Hôpital Lyon Sud jusqu'à la sortie avenue Jean Jaures;2025-01-21 00:00:00;Panne;.;2025-05-30 17:30:00;12408666;2025-05-12 08:55:02
6;2025-05-12 08:54:00;5520;42;Gare Part-Dieu V.Merle;4206;ESCALIER;du quai direction Charpennes (par couloir de liaison direction gare de la Part Dieu) jusqu'à la mezzanine niveau Point Contact.;2025-04-15 00:00:00;Panne;.;2025-06-15 17:30:00;12408667;2025-05-12 08:55:02
7;2025-05-12 08:54:00;5160;45;Jean Macé;451;ASCENSEUR;direction St-Genis-Laval Hôpital Lyon Sud et accès place Jean Macé;2025-05-06 00:00:00;Panne;Accès impossible direction Gare d'Oullins;2025-05-17 17:30:00;12408668;2025-05-12 08:55:02
8;2025-05-12 08:54:00;5160;45;Jean Macé;4501;ESCALIER;du quai direction St-Genis-Laval Hôpital Lyon Sud jusqu'à la sortie place Jean Macé (côté rue Parmentier);2025-03-20 00:00:00;Panne;.;2025-05-20 17:30:00;12408669;2025-05-12 08:55:02
9;2025-05-12 08:54:00;5936;51;Oullins Centre;5105;ESCALIER;entre la mezzanine supérieure et la place Anatole France côté rue de la République;2025-05-12 00:00:00;Panne;emprunter l'autre escalier mécanique si disponible (escalier n°5107 entre la mezzanine supérieure et la place Anatole France côté rue Voltaire);2025-05-12 12:30:00;12408670;2025-05-12 08:55:02
10;2025-05-12 08:54:00;5221;46;Place Jean Jaurès;462;ASCENSEUR;direction Charpennes et accès avenue Jean Jaurès;2025-03-25 00:00:00;Panne; Accès impossible direction Charpennes;2025-05-31 17:30:00;12408671;2025-05-12 08:55:02
11;2025-05-12 08:54:00;5221;46;Place Jean Jaurès;4601;ESCALIER;du quai direction St-Genis-Laval Hôpital Lyon Sud jusqu'à la sortie avenue Jean Jaures;2025-04-10 00:00:00;Panne;.;2025-05-31 17:30:00;12408672;2025-05-12 08:55:02
12;2025-05-12 08:54:00;5221;46;Place Jean Jaurès;4602;ESCALIER;du quai direction Charpennes jusqu'à la sortie avenue Jean Jaures;2025-03-25 00:00:00;Panne;.;2025-05-20 17:30:00;12408673;2025-05-12 08:55:02
13;2025-05-12 08:54:00;5092;44;Saxe - Gambetta;441;ASCENSEUR;direction Charpennes, correspondance Ligne D Gare de Vaise ou Gare de Vénissieux;2025-05-09 00:00:00;Panne;Accès impossible direction Charpennes.  Correspondance impossible Ligne B / Ligne D direction Gare de Vaise ou Gare de Vénissieux.;2025-05-12 15:30:00;12408674;2025-05-12 08:55:02
14;2025-05-12 08:54:00;5092;44;Saxe - Gambetta;4404;ESCALIER;du quai direction Charpennes jusqu'à la mezzanine sud (niveau sortie avenue Jean Jaurès);2025-04-09 00:00:00;Panne;.;2025-05-25 17:30:00;12408675;2025-05-12 08:55:02
15;2025-05-12 08:54:00;5092;44;Saxe - Gambetta;4403;ESCALIER;du quai direction St-Genis-Laval Hôpital Lyon Sud jusqu'à la mezzanine sud (niveau sortie avenue Jean Jaurès);2025-04-07 00:00:00;Panne;.;2025-05-25 17:30:00;12408676;2025-05-12 08:55:02
16;2025-05-12 08:54:00;5092;44;Saxe - Gambetta;4406;ESCALIER;de la mezzanine sud  jusqu'à la sortie avenue Jean Jaurès;2025-05-11 00:00:00;Panne;.;2025-05-25 17:30:00;12408677;2025-05-12 08:55:02
17;2025-05-12 08:54:00;5092;44;Saxe - Gambetta;4408;ESCALIER;du quai ligne B direction St-Genis-Laval Hôpital Lyon Sud (par by pass) jusqu'au quai ligne D direction Gare de Vénissieux;2025-05-12 00:00:00;Panne;.;2025-05-12 11:00:00;12408678;2025-05-12 08:55:02
18;2025-05-12 08:54:00;5200;48;Stade de Gerland Le LOU;481;ASCENSEUR;correspondance entre le quai direction St-Genis-Laval Hôpital Lyon Sud et la mezzanine;2025-04-10 00:00:00;Panne;Accès impossible direction Gare d'Oullins;2025-06-16 19:30:00;12408679;2025-05-12 08:55:02
19;2025-05-12 08:54:00;5200;48;Stade de Gerland Le LOU;4803;ESCALIER;de la mezzanine niveau Point Contact jusqu'à la sortie avenue Jean Jaurès;2025-05-02 00:00:00;Panne;.;2025-05-20 17:30:00;12408680;2025-05-12 08:55:02
20;2025-05-12 08:54:00;5200;48;Stade de Gerland Le LOU;4802;ESCALIER;de la mezzanine niveau Point Contact jusqu'au quai direction Charpennes;2025-04-13 00:00:00;Panne;.;2025-06-30 17:30:00;12408681;2025-05-12 08:55:02
21;2025-05-12 08:54:00;5002;26;Bellecour;2607;ESCALIER;du quai central jusqu'à la mezzanine sud (côté Antonin Poncet);2025-04-18 00:00:00;Entretien programmé;.;2025-05-15 14:00:00;12408682;2025-05-12 08:55:02
22;2025-05-12 08:54:00;5002;26;Bellecour;2606;ESCALIER;du quai central jusqu'à la mezzanine sud (côté Antonin Poncet);2025-02-11 00:00:00;Panne;.;2025-05-31 19:30:00;12408683;2025-05-12 08:55:02
23;2025-05-12 08:54:00;5002;26;Bellecour;2605;ESCALIER;du quai central jusqu'à la mezzanine niveau Point Contact;2025-04-22 00:00:00;Entretien programmé;.;2025-05-15 08:30:00;12408684;2025-05-12 08:55:02
24;2025-05-12 08:54:00;5002;26;Bellecour;2601;ESCALIER;du quai direction Vaulx-en-Velin La Soie jusqu'à la sortie place Bellecour;2025-02-11 00:00:00;Panne;.;2025-05-31 19:30:00;12408685;2025-05-12 08:55:02
25;2025-05-12 08:54:00;5002;26;Bellecour;2608;ESCALIER;de la mezzanine sud (côté Antonin Poncet) jusqu'à la sortie place Antonin Poncet (face à la Poste);2025-02-11 00:00:00;Entretien programmé;.;2025-05-31 18:30:00;12408686;2025-05-12 08:55:02
26;2025-05-12 08:54:00;5103;84;Gare de Vaise;849;ASCENSEUR;Parc Relais, ascenseur de gauche;2025-05-12 00:00:00;Panne;.;2025-05-12 09:00:00;12408687;2025-05-12 08:55:02
27;2025-05-12 08:54:00;5104;70;Gare de Vénissieux;7001;ESCALIER;de la mezzanine vers le quai de départ direction Gare de Vaise;2025-04-08 00:00:00;Entretien programmé;.;2025-05-31 12:00:00;12408688;2025-05-12 08:55:02
28;2025-05-12 08:54:00;5181;77;Garibaldi;7701;ESCALIER;du quai direction Gare de Vaise jusqu'à la mezzanine;2025-04-27 00:00:00;Panne;.;2025-05-16 10:30:00;12408689;2025-05-12 08:55:02
29;2025-05-12 08:54:00;5181;77;Garibaldi;7702;ESCALIER;du quai direction Gare de Vénissieux jusqu'à la mezzanine;2024-11-17 00:00:00;Entretien programmé;.;2025-05-31 20:30:00;12408690;2025-05-12 08:55:02
30;2025-05-12 08:54:00;5040;82;Gorge de Loup;821;ASCENSEUR;direction Gare de Vaise, accès Gare Routière ou Parc Relais;2025-05-10 00:00:00;Panne;Accès impossible direction Gare de Vaise.;2025-06-02 10:00:00;12408691;2025-05-12 08:55:02
31;2025-05-12 08:54:00;5040;82;Gorge de Loup;822;ASCENSEUR;direction Gare de Vénissieux, correspondance quai direction Gare de Vaise, accès Gare Routière ou Gare SNCF et rue Sergent Michel Berthet;2025-04-28 00:00:00;Entretien programmé;Accès impossible direction Gare de Vénissieux;2025-05-17 18:30:00;12408692;2025-05-12 08:55:02
32;2025-05-12 08:54:00;5040;82;Gorge de Loup;8205;ESCALIER;sortie Place Basse (côté agence commerciale) niveau Parc Relais, jusqu'à la mezzanine niveau départ gare de bus, rue Sergent Michel Berthet;2025-03-21 00:00:00;Panne;.;2025-06-30 10:30:00;12408693;2025-05-12 08:55:02
33;2025-05-12 08:54:00;5041;74;Grange Blanche;7401;ESCALIER;de place d'Arsonval (descente de bus) jusqu'à la mezzanine face à la croissanterie;2025-03-18 00:00:00;Entretien programmé;.;2025-06-15 15:30:00;12408694;2025-05-12 08:55:02
34;2025-05-12 08:54:00;5041;74;Grange Blanche;7402;ESCALIER;de la mezzanine côté hôpital Edouard Herriot jusqu'à la sortie Hôpital Edouard Herriot;2024-12-13 00:00:00;Panne;.;2025-06-30 07:30:00;12408695;2025-05-12 08:55:02
35;2025-05-12 08:54:00;5041;74;Grange Blanche;7405;ESCALIER;de la mezzanine (face à l'ascenseur) jusqu'au quai central (direction Gare de Vénissieux ou Gare de Vaise);2025-05-08 00:00:00;Panne;.;2025-05-15 02:00:00;12408696;2025-05-12 08:55:02
36;2025-05-12 08:54:00;5044;79;Guillotière Gabriel Péri;792;ASCENSEUR;direction Gare de Vénissieux, correspondance quai direction Gare de Vaise;2025-05-11 00:00:00;Panne; Accès impossible direction Gare de Vénissieux;2025-05-19 02:30:00;12408697;2025-05-12 08:55:02
37;2025-05-12 08:54:00;5062;73;Laennec;7301;ESCALIER;du quai direction Gare de Vaise jusqu'à la sortie rue Guillaume Paradin;2025-02-25 00:00:00;Entretien programmé;.;2025-06-15 19:30:00;12408698;2025-05-12 08:55:02
38;2025-05-12 08:54:00;5062;73;Laennec;7302;ESCALIER;du quai direction Gare de Vénissieux jusqu'à la sortie rue Guillaume Paradin;2025-04-04 00:00:00;Entretien programmé;.;2025-05-17 17:30:00;12408699;2025-05-12 08:55:02
39;2025-05-12 08:54:00;5082;72;Mermoz - Pinel;721;ASCENSEUR;direction Gare de Vaise, accès avenue Jean Mermoz;2025-05-11 00:00:00;Panne;Accès impossible direction Gare de Vaise;2025-05-20 23:30:00;12408700;2025-05-12 08:55:02
40;2025-05-12 08:54:00;5083;75;Monplaisir Lumière;7502;ESCALIER;du quai direction Gare de Vénissieux jusqu'à la sortie cours Albert Thomas;2025-01-13 00:00:00;Entretien programmé;.;2025-05-30 09:30:00;12408701;2025-05-12 08:55:02
41;2025-05-12 08:54:00;5084;71;Parilly;7101;ESCALIER;du quai direction Gare de Vaise jusqu'à la sortie rue de La Fontaine;2025-04-05 00:00:00;Entretien programmé;.;2025-05-31 17:00:00;12408702;2025-05-12 08:55:02
42;2025-05-12 08:54:00;5091;76;Sans Souci;7602;ESCALIER;du quai direction Gare de Vénissieux jusqu'à la sortie cours Albert Thomas;2025-05-07 00:00:00;Entretien programmé;.;2025-05-14 17:00:00;12408703;2025-05-12 08:55:02
43;2025-05-12 08:54:00;5094;83;Valmy;8302;ESCALIER;de la mezzanine jusqu'à la sortie place Valmy;2025-04-30 00:00:00;Entretien programmé;.;2025-07-14 13:00:00;12408704;2025-05-12 08:55:02
44;2025-05-12 08:54:00;5095;81;Vieux Lyon;8107;ESCALIER;de la mezzanine niveau -3 (correspondance ligne D direction Gare de Vaise ou Gare de Vénissieux) jusqu'à la mezzanine niveau Point Contact, accès rue du Doyenné.;2025-04-17 00:00:00;Panne;.;2025-05-17 20:30:00;12408705;2025-05-12 08:55:02
45;2025-05-12 08:54:00;5046;24;Hôtel de Ville L. Pradel;242;ASCENSEUR;direction Vaulx-en-Velin La Soie, correspondance ligne A / ligne C direction Cuire, accès Mairie Annexe;2025-05-12 00:00:00;Accès fermé pour travaux;Direction Vaulx-en-Velin La Soie, prendre l'autre ascenseur et passer par la ligne C;2025-05-12 11:00:00;12408706;2025-05-12 08:55:02
46;2025-05-12 08:54:00;5240;96;IUT Feyssine;961;ASCENSEUR;Liaison entre les quais arrivée et départ et le Boulevard Laurent Bonnevay;2025-05-12 00:00:00;Accès fermé pour travaux;Liaison impossible;2025-05-12 11:00:00;12408707;2025-05-12 08:55:02
47;2025-05-12 08:54:00;5002;26;Bellecour;261;ASCENSEUR;direction Vaulx-en-Velin La Soie, correspondance ligne A direction Perrache et  ligne D, direction Gare de Vénissieux ou Gare de Vaise;2025-03-19 00:00:00;Panne;Pour correspondance ligne A direction Perrache et ligne D directions Gare de Vénissieux ou Gare de Vaise, utiliser les autres ascenseurs en passant par la surface;2025-05-25 14:30:00;12408708;2025-05-12 08:55:02
48;2025-05-12 08:54:00;5021;25;Cordeliers;2502;ESCALIER;du quai direction Vaulx-en-Velin La Soie jusqu'à la sortie place des Cordeliers;2025-05-12 00:00:00;Accès fermé pour travaux;.;2025-05-12 10:00:00;12408709;2025-05-12 08:55:02
49;2025-05-12 08:54:00;5024;18;Flachet;182;ASCENSEUR;direction Vaulx-en-Velin La Soie, accès cours Emile Zola;2025-02-03 00:00:00;Panne;Accès impossible direction Vaulx-en-Velin La Soie;2025-05-17 17:30:00;12408710;2025-05-12 08:55:02
50;2025-05-12 08:54:00;5024;18;Flachet;1801;ESCALIER;du quai direction Perrache jusqu'à la sortie cours Emile Zola;2025-04-17 00:00:00;Panne;.;2025-05-16 17:30:00;12408711;2025-05-12 08:55:02
51;2025-05-12 08:54:00;5024;18;Flachet;1802;ESCALIER;du quai direction Vaulx-en-Velin La Soie jusqu'à la sortie cours Emile Zola;2025-05-12 00:00:00;Panne;.;2025-05-12 10:30:00;12408712;2025-05-12 08:55:02
52;2025-05-12 08:54:00;5101;16;Laurent Bonnevay;169;ASCENSEUR;Parc Relais;2025-05-12 00:00:00;Panne;Accès aux différents niveaux impossible;2025-05-12 11:00:00;12408713;2025-05-12 08:55:02
53;2025-05-12 08:54:00;5101;16;Laurent Bonnevay;1602;ESCALIER;de la passerelle piéton, venant de la gare routière bus, jusqu'à la mezzanine piéton;2025-05-12 00:00:00;Panne;.;2025-05-12 10:30:00;12408714;2025-05-12 08:55:02
54;2025-05-12 08:54:00;5183;20;République Villeurbanne;2001;ESCALIER;du quai direction Perrache jusqu'à la sortie cours Emile Zola;2025-05-12 00:00:00;Panne;.;2025-05-12 10:30:00;12408715;2025-05-12 08:55:02
55;2025-05-12 08:54:00;5564;15;Vaulx-en-Velin La Soie;158;ASCENSEUR;Parc Relais Est;2025-05-12 00:00:00;Panne;Accès aux différents niveaux impossible;2025-05-12 11:00:00;12408716;2025-05-12 08:55:02
