Date màj;Code lieu;Code station;Nom station;Code équipement;Type équipement;Equipement;Début indispo;Cause;Conséquence;Fin indispo
2025-02-08 02:34:00;5004;41;Brotteaux;412;ASCENSEUR;du quai direction Charpennes, accès mezzanine de correspondance avec le quai direction St-Genis-Laval Hôpital Lyon Sud et accès place Jules Ferry;2025-02-08;Accès fermé pour travaux;Accès impossible à la station;2025-02-08 04:00:00
2025-02-08 02:34:00;5004;41;Brotteaux;411;ASCENSEUR;direction St-Genis-Laval Hôpital Lyon Sud, accès mezzanine de correspondance avec le quai direction Charpennes;2025-02-08;Accès fermé pour travaux;Accès impossible direction Gare d'Oullins;2025-02-08 04:00:00
2025-02-08 02:34:00;5004;41;Brotteaux;4101;ESCALIER;de la mezzanine jusqu'à la sortie Gare des Brotteaux;2025-02-07;Accès fermé pour travaux;.;2025-02-08 04:30:00
2025-02-08 02:34:00;5102;21;Charpennes;213;ASCENSEUR;du quai direction St-Genis-Laval Hôpital Lyon Sud, correspondance ligne A direction Perrache par le couloir de liaison, accès Place Charles Hernu.;2025-02-08;Panne;Accès direct ligne B direction Gare d'Oullins impossible. Emprunter l'ascenseur numéro 211 de la ligne A quai direction Perrache et revenir par le couloir de liaison;2025-02-08 04:00:00
2025-02-08 02:34:00;5102;21;Charpennes;212;ASCENSEUR;du quai direction Vaulx-en-Velin La Soie, correspondance ligne B direction Gare d'Oullins et accès cours Emile Zola;2025-02-08;Panne;Accès impossible direction Vaulx-en-Velin La Soie, correspondance ligne A direction Vaulx-en-Velin La Soie / ligne B impossible;2025-02-08 04:00:00
2025-02-08 02:34:00;5220;47;Debourg;471;ASCENSEUR;direction St-Genis-Laval Hôpital Lyon Sud et accès avenue Jean Jaurès;2025-02-08;Panne;Accès impossible direction Gare d'Oullins;2025-02-08 04:00:00
2025-02-08 02:34:00;5220;47;Debourg;472;ASCENSEUR;direction Charpennes et accès avenue Jean Jaurès;2025-02-08;Panne; Accès impossible direction Charpennes;2025-02-08 04:00:00
2025-02-08 02:34:00;5220;47;Debourg;4701;ESCALIER;du quai direction St-Genis-Laval Hôpital Lyon Sud jusqu'à la sortie avenue Jean Jaures;2025-01-21;Panne;.;2025-04-04 17:30:00
2025-02-08 02:34:00;5220;47;Debourg;4702;ESCALIER;du quai direction Charpennes jusqu'à la sortie avenue Jean Jaures;2024-11-12;Panne;.;2025-02-08 17:30:00
2025-02-08 02:34:00;5904;50;Gare d'Oullins;501;ASCENSEUR;correspondance entre le quai d'arrivée et la mezzanine;2025-02-07;Panne;Sortie de la station impossible;2025-02-22 17:30:00
2025-02-08 02:34:00;5904;50;Gare d'Oullins;503;ASCENSEUR;correspondance entre la mezzanine et la rue côté Quai 1;2025-02-08;Panne;Accès à la station et accès SNCF impossibles;2025-02-08 04:00:00
2025-02-08 02:34:00;5520;42;Gare Part-Dieu V.Merle;421;ASCENSEUR;direction St-Genis-Laval Hôpital Lyon Sud, correspondance avec la gare SNCF et accès Bd Vivier Merle;2025-02-08;Panne;Accès impossible direction Gare d'Oullins;2025-02-08 04:00:00
2025-02-08 02:34:00;5520;42;Gare Part-Dieu V.Merle;422;ASCENSEUR;direction Charpennes, correspondance avec la gare SNCF et accès Bd Vivier Merle;2025-02-08;Panne;Accès impossible direction Charpennes;2025-02-08 04:00:00
2025-02-08 02:34:00;5520;42;Gare Part-Dieu V.Merle;4209;ESCALIER;de la mezzanine niveau Point Contact (par couloir de liaison) jusqu'à la sortie Gare de la Part Dieu;2025-02-08;Panne;.;2025-02-08 04:00:00
2025-02-08 02:34:00;5520;42;Gare Part-Dieu V.Merle;4207;ESCALIER;de la mezzanine niveau Point Contact jusqu'au quai direction St-Genis-Laval Hôpital Lyon Sud (par couloir de liaison);2025-02-08;Panne;.;2025-02-08 04:00:00
2025-02-08 02:34:00;5520;42;Gare Part-Dieu V.Merle;4206;ESCALIER;du quai direction Charpennes (par couloir de liaison direction gare de la Part Dieu) jusqu'à la mezzanine niveau Point Contact.;2025-02-08;Panne;.;2025-02-08 04:30:00
2025-02-08 02:34:00;5520;42;Gare Part-Dieu V.Merle;4205;ESCALIER;du quai direction St-Genis-Laval Hôpital Lyon Sud (par couloir de liaison direction gare de la Part Dieu) jusqu'à la mezzanine niveau Point Contact.;2025-01-09;Panne;.;2025-03-21 17:30:00
2025-02-08 02:34:00;5520;42;Gare Part-Dieu V.Merle;4202;ESCALIER;de la mezzanine niveau centre commercial jusqu'au quai direction Charpennes;2025-02-08;Panne;.;2025-02-08 04:00:00
2025-02-08 02:34:00;5520;42;Gare Part-Dieu V.Merle;4201;ESCALIER;du quai direction St-Genis-Laval Hôpital Lyon Sud jusqu'à la mezzanine niveau centre commercial;2025-02-08;Panne;.;2025-02-08 04:00:00
2025-02-08 02:34:00;5160;45;Jean Macé;451;ASCENSEUR;direction St-Genis-Laval Hôpital Lyon Sud et accès place Jean Macé;2025-02-08;Panne;Accès impossible direction Gare d'Oullins;2025-02-08 04:00:00
2025-02-08 02:34:00;5160;45;Jean Macé;452;ASCENSEUR;direction Charpennes et accès place Jean Macé;2025-02-08;Panne;Accès impossible direction Charpennes;2025-02-08 04:00:00
2025-02-08 02:34:00;5936;51;Oullins Centre;511;ASCENSEUR;entre le quai direction St-Genis-Laval Hôpital Lyon Sud et la mezzanine supérieure;2025-02-08;Panne;connexion impossible entre le quai direction St-Genis-Laval Hôpital Lyon Sud et la mezzanine supérieure;2025-02-08 04:00:00
2025-02-08 02:34:00;5936;51;Oullins Centre;512;ASCENSEUR;entre le quai direction Charpennes et la mezzanine supérieure;2025-02-08;Panne;connexion impossible entre le quai direction Charpennes et la mezzanine supérieure;2025-02-08 04:00:00
2025-02-08 02:34:00;5936;51;Oullins Centre;5102;ESCALIER;du quai direction Charpennes vers la mezzanine inférieure;2025-02-08;Panne;utiliser l'ascenseur n°512, si disponible, reliant le quai et la mezzanine supérieure;2025-02-08 03:00:00
2025-02-08 02:34:00;5936;51;Oullins Centre;5105;ESCALIER;entre la mezzanine supérieure et la place Anatole France côté rue de la République;2025-02-08;Panne;emprunter l'autre escalier mécanique si disponible (escalier n°5107 entre la mezzanine supérieure et la place Anatole France côté rue Voltaire);2025-02-08 03:00:00
2025-02-08 02:34:00;5043;43;Place Guichard;431;ASCENSEUR;direction St-Genis-Laval Hôpital Lyon Sud et accès place Guichard;2024-12-24;Panne;Accès impossible direction Gare d'Oullins;2025-02-28 17:30:00
2025-02-08 02:34:00;5043;43;Place Guichard;432;ASCENSEUR;direction Charpennes et accès place Guichard;2025-02-08;Panne;Accès impossible direction Charpennes.;2025-02-08 04:00:00
2025-02-08 02:34:00;5221;46;Place Jean Jaurès;461;ASCENSEUR;direction St-Genis-Laval Hôpital Lyon Sud et accès avenue Jean Jaurès;2025-02-01;Panne;Accès impossible direction Gare d'Oullins;2025-02-15 17:30:00
2025-02-08 02:34:00;5221;46;Place Jean Jaurès;462;ASCENSEUR;direction Charpennes et accès avenue Jean Jaurès;2025-02-08;Panne; Accès impossible direction Charpennes;2025-02-08 04:00:00
2025-02-08 02:34:00;5221;46;Place Jean Jaurès;4601;ESCALIER;du quai direction St-Genis-Laval Hôpital Lyon Sud jusqu'à la sortie avenue Jean Jaures;2024-10-09;Panne;.;2025-03-15 17:30:00
2025-02-08 02:34:00;5221;46;Place Jean Jaurès;4602;ESCALIER;du quai direction Charpennes jusqu'à la sortie avenue Jean Jaures;2024-11-02;Panne;.;2025-02-28 17:30:00
2025-02-08 02:34:00;5092;44;Saxe - Gambetta;4408;ESCALIER;du quai ligne B direction St-Genis-Laval Hôpital Lyon Sud (par by pass) jusqu'au quai ligne D direction Gare de Vénissieux;2025-02-08;Panne;.;2025-02-08 03:30:00
2025-02-08 02:34:00;5092;44;Saxe - Gambetta;4410;ESCALIER;du quai ligne B direction Charpennes (par by pass) jusqu'au quai  ligne D direction Gare de Vénissieux;2025-02-07;Panne;.;2025-02-08 04:30:00
2025-02-08 02:34:00;5200;48;Stade de Gerland Le LOU;481;ASCENSEUR;correspondance entre le quai direction St-Genis-Laval Hôpital Lyon Sud et la mezzanine;2025-02-08;Panne;Accès impossible direction Gare d'Oullins;2025-02-08 04:00:00
2025-02-08 02:34:00;5200;48;Stade de Gerland Le LOU;483;ASCENSEUR;correspondance entre la mezzanine et l'avenue Jean Jaurès;2025-02-08;Panne; Accès station impossible;2025-02-08 04:00:00
2025-02-08 02:34:00;5200;48;Stade de Gerland Le LOU;482;ASCENSEUR;correspondance entre la mezzanine et le quai direction Charpennes;2025-02-08;Panne; Accès impossible direction Charpennes;2025-02-08 04:00:00
2025-02-08 02:34:00;5200;48;Stade de Gerland Le LOU;4803;ESCALIER;de la mezzanine niveau Point Contact jusqu'à la sortie avenue Jean Jaurès;2025-02-08;Panne;.;2025-02-08 04:00:00
2025-02-08 02:34:00;5200;48;Stade de Gerland Le LOU;4802;ESCALIER;de la mezzanine niveau Point Contact jusqu'au quai direction Charpennes;2024-10-23;Panne;.;2025-03-28 17:30:00
2025-02-08 02:34:00;5937;52;St-Genis Hôp. Lyon Sud;522;ASCENSEUR;entre la surface et le quai direction Charpennes;2025-02-08;Panne;accès impossible au quai direction Charpennes;2025-02-08 04:00:00
2025-02-08 02:34:00;5937;52;St-Genis Hôp. Lyon Sud;521;ASCENSEUR;entre le quai direction St-Genis-Laval Hôpital Lyon Sud et la surface;2025-02-08;Panne;sortie impossible de la station;2025-02-08 04:00:00
2025-02-08 02:34:00;5002;26;Bellecour;263;ASCENSEUR;direction Gare de Vaise ou Gare de Vénissieux, correspondance Ligne A direction Perrache ou Vaulx-en-Velin La Soie;2025-02-06;Panne;Accès impossible ligne D;2026-02-06 13:30:00
2025-02-08 02:34:00;5002;26;Bellecour;2602;ESCALIER;du quai direction Vaulx-en-Velin La Soie jusqu'à la sortie rue de la République;2025-02-06;Panne;.;2025-03-11 14:30:00
2025-02-08 02:34:00;5002;26;Bellecour;2612;ESCALIER;du quai direction Vaulx-en-Velin La Soie jusqu'à la sortie place Bellecour;2025-02-08;Panne;.;2025-02-08 04:00:00
2025-02-08 02:34:00;5002;26;Bellecour;2610;ESCALIER;du quai direction Vaulx-en-Velin La Soie jusqu'à la sortie rue de la République;2025-02-08;Panne;.;2025-02-08 04:00:00
2025-02-08 02:34:00;5002;26;Bellecour;2608;ESCALIER;de la mezzanine sud (côté Antonin Poncet) jusqu'à la sortie place Antonin Poncet (face à la Poste);2025-02-06;Panne;.;2025-03-11 00:00:00
2025-02-08 02:34:00;5002;26;Bellecour;2607;ESCALIER;du quai central jusqu'à la mezzanine sud (côté Antonin Poncet);2025-02-06;Panne;.;2025-03-11 00:00:00
2025-02-08 02:34:00;5002;26;Bellecour;2606;ESCALIER;du quai central jusqu'à la mezzanine sud (côté Antonin Poncet);2025-02-06;Panne;.;2025-03-11 00:00:00
2025-02-08 02:34:00;5002;26;Bellecour;2603;ESCALIER;du by-pass de correspondance ligne D / ligne A jusqu'au quai ligne A direction Vaulx-en-Velin La Soie;2025-02-06;Panne;.;2025-03-11 15:00:00
2025-02-08 02:34:00;5002;26;Bellecour;2605;ESCALIER;du quai central jusqu'à la mezzanine niveau Point Contact;2025-02-06;Panne;.;2025-03-11 00:00:00
2025-02-08 02:34:00;5103;84;Gare de Vaise;8402;ESCALIER;sortie rue du 24 mars 1852.;2025-02-08;Panne;.;2025-02-08 04:00:00
2025-02-08 02:34:00;5181;77;Garibaldi;7701;ESCALIER;du quai direction Gare de Vaise jusqu'à la mezzanine;2025-02-05;Panne;.;2025-02-15 14:30:00
2025-02-08 02:34:00;5040;82;Gorge de Loup;821;ASCENSEUR;direction Gare de Vaise, accès Gare Routière ou Parc Relais;2025-02-07;Panne;Accès impossible direction Gare de Vaise.;2025-02-10 07:30:00
2025-02-08 02:34:00;5040;82;Gorge de Loup;8203;ESCALIER;du quai direction Gare de Vaise jusqu'à la sortie sur le quai SNCF direction Sain- Bel, Brignais, Lauzanne;2025-02-05;Entretien programmé;.;2025-02-12 15:30:00
2025-02-08 02:34:00;5040;82;Gorge de Loup;8205;ESCALIER;sortie Place Basse (côté agence commerciale) niveau Parc Relais, jusqu'à la mezzanine niveau départ gare de bus, rue Sergent Michel Berthet;2025-02-08;Accès fermé pour travaux;.;2025-02-08 04:30:00
2025-02-08 02:34:00;5041;74;Grange Blanche;7402;ESCALIER;de la mezzanine côté hôpital Edouard Herriot jusqu'à la sortie Hôpital Edouard Herriot;2024-12-13;Panne;.;2025-03-07 07:30:00
2025-02-08 02:34:00;5041;74;Grange Blanche;7406;ESCALIER;de la mezzanine jusqu'à la sortie place d' Arsonval (départ bus);2024-09-06;Entretien programmé;.;2025-04-01 16:30:00
2025-02-08 02:34:00;5062;73;Laennec;7302;ESCALIER;du quai direction Gare de Vénissieux jusqu'à la sortie rue Guillaume Paradin;2024-12-11;Entretien programmé;.;2025-02-10 11:00:00
2025-02-08 02:34:00;5083;75;Monplaisir Lumière;7502;ESCALIER;du quai direction Gare de Vénissieux jusqu'à la sortie cours Albert Thomas;2025-01-13;Entretien programmé;.;2025-03-28 09:30:00
2025-02-08 02:34:00;5084;71;Parilly;7101;ESCALIER;du quai direction Gare de Vaise jusqu'à la sortie rue de La Fontaine;2025-01-23;Panne;.;2025-02-21 15:30:00
2025-02-08 02:34:00;5091;76;Sans Souci;761;ASCENSEUR;direction Gare de Vaise, accès cours Albert Thomas;2025-02-08;Accès fermé pour travaux;Accès impossible direction Gare de Vaise.;2025-02-08 04:30:00
2025-02-08 02:34:00;5091;76;Sans Souci;7602;ESCALIER;du quai direction Gare de Vénissieux jusqu'à la sortie cours Albert Thomas;2024-12-17;Panne;.;2025-02-21 19:00:00
2025-02-08 02:34:00;5094;83;Valmy;8302;ESCALIER;de la mezzanine jusqu'à la sortie place Valmy;2025-02-05;Panne;.;2025-03-05 12:30:00
2025-02-08 02:34:00;5095;81;Vieux Lyon;8107;ESCALIER;de la mezzanine niveau -3 (correspondance ligne D direction Gare de Vaise ou Gare de Vénissieux) jusqu'à la mezzanine niveau Point Contact, accès rue du Doyenné.;2024-12-07;Panne;.;2025-02-28 15:00:00
2025-02-08 02:34:00;5223;57;Croix-Rousse;571;ASCENSEUR;direction Cuire, correspondance avec le quai direction Hôtel de Ville, et accès Bd de la Croix Rousse;2025-02-08;Panne;Accès station impossible;2025-02-08 04:00:00
2025-02-08 02:34:00;5223;57;Croix-Rousse;572;ASCENSEUR;direction Hôtel de Ville, correspondance avec le quai direction Cuire;2025-02-08;Panne;Accès ligne C direction Hôtel de Ville impossible;2025-02-08 04:00:00
2025-02-08 02:34:00;5223;57;Croix-Rousse;5701;ESCALIER;du quai direction Cuire jusqu'à la mezzanine;2025-02-04;Panne;.;2025-02-25 15:30:00
2025-02-08 02:34:00;5223;57;Croix-Rousse;5702;ESCALIER;du quai direction Hôtel de Ville jusqu'à la mezzanine;2025-02-04;Panne;.;2025-02-14 20:30:00
2025-02-08 02:34:00;5045;58;Hénon;581;ASCENSEUR;direction Cuire, accès Bd des Canuts;2025-02-08;Panne;Accès impossible direction Cuire;2025-02-08 04:00:00
2025-02-08 02:34:00;5045;58;Hénon;582;ASCENSEUR;direction Hôtel de Ville, accès rue Hénon;2025-02-08;Panne;Accès impossible direction Hôtel de Ville;2025-02-08 04:00:00
2025-02-08 02:34:00;5046;24;Hôtel de Ville L. Pradel;242;ASCENSEUR;direction Vaulx-en-Velin La Soie, correspondance ligne A / ligne C direction Cuire, accès Mairie Annexe;2025-02-08;Panne;Direction Vaulx-en-Velin La Soie, prendre l'autre ascenseur et passer par la ligne C;2025-02-08 04:00:00
2025-02-08 02:34:00;5046;24;Hôtel de Ville L. Pradel;243;ASCENSEUR;correspondance entre la ligne C et la ligne A direction Vaulx-en-Velin La Soie, accès Mairie Annexe;2025-02-08;Panne;Pour correspondance ligne C / ligne A direction Vaulx-en-Velin La Soie, prendre l'autre ascenseur et passer par la surface.;2025-02-08 04:00:00
2025-02-08 02:34:00;5000;27;Ampère Victor Hugo;272;ASCENSEUR;direction Vaulx-en-Velin La Soie;2025-02-08;Panne;Accès impossible direction Vaux-en-Velin La Soie;2025-02-08 04:00:00
2025-02-08 02:34:00;5021;25;Cordeliers;252;ASCENSEUR;direction Vaulx-en-Velin La Soie et accès rue de la République;2025-02-08;Panne;Accès impossible direction Vaulx-en-Velin La Soie;2025-02-08 04:00:00
2025-02-08 02:34:00;5023;17;Cusset;171;ASCENSEUR;direction Perrache, accès mezzanine de correspondance direction Vaulx-en-Velin La Soie, accès cours Emile Zola;2025-01-30;Panne;Accès impossible direction Perrache.  Accès impossible cours Emile Zola .;2025-02-08 14:30:00
2025-02-08 02:34:00;5023;17;Cusset;172;ASCENSEUR;du quai direction Vaulx-en-Velin La Soie jusqu'à la mezzanine et accès cours Emile Zola;2025-02-08;Panne;Accès impossible direction Vaulx-en-Velin La Soie;2025-02-08 04:00:00
2025-02-08 02:34:00;5024;18;Flachet;181;ASCENSEUR;direction Perrache, accès cours Emile Zola;2025-02-08;Panne;Accès impossible direction Perrache;2025-02-08 04:00:00
2025-02-08 02:34:00;5024;18;Flachet;182;ASCENSEUR;direction Vaulx-en-Velin La Soie, accès cours Emile Zola;2025-02-03;Panne;Accès impossible direction Vaulx-en-Velin La Soie;2025-03-03 14:30:00
2025-02-08 02:34:00;5182;23;Foch;232;ASCENSEUR;direction Vaulx-en-Velin La Soie et accès cours Franklin Roosevelt;2025-02-08;Panne;Accès impossible direction Vaulx-en-Velin La Soie;2025-02-08 04:00:00
2025-02-08 02:34:00;5182;23;Foch;2302;ESCALIER;du quai  direction Vaulx-en-Velin La Soie  jusqu'à la sortie angle cours Franklin Roosevelt / avenue du Maréchal de Saxe;2025-01-26;Panne;.;2025-02-13 17:30:00
2025-02-08 02:34:00;5101;16;Laurent Bonnevay;161;ASCENSEUR;direction Perrache, accès à la mezzanine;2025-02-08;Panne;Accès impossible au quai direction Perrache;2025-02-08 04:00:00
2025-02-08 02:34:00;5081;22;Masséna;221;ASCENSEUR;direction Perrache et accès cours Vitton;2025-02-08;Panne;Accès impossible direction Perrache;2025-02-08 04:00:00
2025-02-08 02:34:00;5081;22;Masséna;222;ASCENSEUR;direction Vaulx-en-Velin La Soie et accès cours Vitton;2025-02-08;Panne;Accès impossible direction Vaulx-en-Velin La Soie;2025-02-08 04:00:00
2025-02-08 02:34:00;5081;22;Masséna;2201;ESCALIER;du quai direction Perrache jusqu'à la sortie cours Vitton;2025-02-08;Panne;.;2025-02-08 04:00:00
2025-02-08 02:34:00;5183;20;République Villeurbanne;202;ASCENSEUR;du quai direction Vaulx-en-Velin La Soie, accès cours Emile Zola;2025-02-08;Panne;Accès impossible direction Vaulx-en-Velin La Soie;2025-02-08 04:00:00
2025-02-08 02:34:00;5564;15;Vaulx-en-Velin La Soie;151;ASCENSEUR;du quai direction Perrache, correspondance avec la Gare Routière;2025-02-08;Panne;Accès impossible au quai de départ direction Perrache;2025-02-08 04:00:00
2025-02-08 02:34:00;5564;15;Vaulx-en-Velin La Soie;152;ASCENSEUR;correspondance entre le quai d'arrivée et la Gare Routière;2025-02-08;Panne;Accès impossible à la Gare Routière;2025-02-08 04:00:00
