Date màj;Code lieu;Code station;Nom station;Code équipement;Type équipement;Equipement;Début indispo;Cause;Conséquence;Fin indispo
2024-10-10 00:44:00;5102;21;Charpennes;212;ASCENSEUR;du quai direction Vaulx-en-Velin La Soie, correspondance ligne B direction Gare d'Oullins et accès cours Emile Zola;2024-10-10;Panne;Accès impossible direction Vaulx-en-Velin La Soie, correspondance ligne A direction Vaulx-en-Velin La Soie / ligne B impossible;2024-10-10 02:30:00
2024-10-10 00:44:00;5102;21;Charpennes;213;ASCENSEUR;du quai direction St-Genis-Laval Hôpital Lyon Sud, correspondance ligne A direction Perrache par le couloir de liaison, accès Place Charles Hernu.;2024-10-03;Panne;Accès direct ligne B direction Gare d'Oullins impossible. Emprunter l'ascenseur numéro 211 de la ligne A quai direction Perrache et revenir par le couloir de liaison;2024-10-15 08:30:00
2024-10-10 00:44:00;5102;21;Charpennes;2102;ESCALIER;du quai direction Vaulx-en-Velin La Soie jusqu'à la sortie angle cours Emile Zola / rue des Emeraudes;2024-10-09;Panne;.;2024-10-10 03:00:00
2024-10-10 00:44:00;5220;47;Debourg;4701;ESCALIER;du quai direction St-Genis-Laval Hôpital Lyon Sud jusqu'à la sortie avenue Jean Jaures;2024-06-06;Panne;.;2024-11-09 22:30:00
2024-10-10 00:44:00;5904;50;Gare d'Oullins;503;ASCENSEUR;correspondance entre la mezzanine et la rue côté Quai 1;2024-10-10;Panne;Accès à la station et accès SNCF impossibles;2024-10-10 02:30:00
2024-10-10 00:44:00;5904;50;Gare d'Oullins;501;ASCENSEUR;correspondance entre le quai d'arrivée et la mezzanine;2024-10-10;Panne;Sortie de la station impossible;2024-10-10 02:30:00
2024-10-10 00:44:00;5904;50;Gare d'Oullins;5002;ESCALIER;correspondance entre la mezzanine et le quai de départ direction Charpennes;2024-10-09;Panne;.;2024-10-10 01:00:00
2024-10-10 00:44:00;5160;45;Jean Macé;4502;ESCALIER;Place Jean Macé face, à la rue Professeur Grignard;2024-09-18;Panne;.;2024-10-18 18:00:00
2024-10-10 00:44:00;5936;51;Oullins Centre;511;ASCENSEUR;entre le quai direction St-Genis-Laval Hôpital Lyon Sud et la mezzanine supérieure;2024-10-10;Panne;connexion impossible entre le quai direction St-Genis-Laval Hôpital Lyon Sud et la mezzanine supérieure;2024-10-10 02:30:00
2024-10-10 00:44:00;5043;43;Place Guichard;431;ASCENSEUR;direction St-Genis-Laval Hôpital Lyon Sud et accès place Guichard;2024-10-04;Panne;Accès impossible direction Gare d'Oullins;2024-10-20 23:30:00
2024-10-10 00:44:00;5221;46;Place Jean Jaurès;4601;ESCALIER;du quai direction St-Genis-Laval Hôpital Lyon Sud jusqu'à la sortie avenue Jean Jaures;2024-10-09;Panne;.;2024-10-19 10:00:00
2024-10-10 00:44:00;5092;44;Saxe - Gambetta;443;ASCENSEUR;direction Gare de Vénissieux, correspondance Ligne B direction Charpennes ou St-Genis-Laval Hôpital Lyon Sud, accès place Victor Basch;2024-09-14;Panne;Ligne B inaccessible.  Ligne D direction Gare de Vaise inaccessible. Correspondance impossible ligne B direction Gare d'Oullins et ligne D direction Gare de Vénissieux.;2024-10-20 20:30:00
2024-10-10 00:44:00;5092;44;Saxe - Gambetta;4405;ESCALIER;de la mezzanine nord (niveau ligne D direction Gare de Vaise) jusqu'à la sortie angle avenue Jean Jaurès / avenue de Saxe;2024-10-08;Panne;.;2024-10-11 20:30:00
2024-10-10 00:44:00;5200;48;Stade de Gerland Le LOU;483;ASCENSEUR;correspondance entre la mezzanine et l'avenue Jean Jaurès;2024-10-10;Panne; Accès station impossible;2024-10-10 02:30:00
2024-10-10 00:44:00;5200;48;Stade de Gerland Le LOU;481;ASCENSEUR;correspondance entre le quai direction St-Genis-Laval Hôpital Lyon Sud et la mezzanine;2024-10-10;Panne;Accès impossible direction Gare d'Oullins;2024-10-10 02:30:00
2024-10-10 00:44:00;5200;48;Stade de Gerland Le LOU;4801;ESCALIER;du quai d'arrivée jusqu'à la mezzanine niveau Point Contact;2024-10-10;Panne;.;2024-10-10 02:30:00
2024-10-10 00:44:00;5200;48;Stade de Gerland Le LOU;4803;ESCALIER;de la mezzanine niveau Point Contact jusqu'à la sortie avenue Jean Jaurès;2024-10-09;Accès fermé pour travaux;.;2024-10-10 03:00:00
2024-10-10 00:44:00;5937;52;St-Genis Hôp. Lyon Sud;521;ASCENSEUR;entre le quai direction St-Genis-Laval Hôpital Lyon Sud et la surface;2024-10-10;Panne;sortie impossible de la station;2024-10-10 02:30:00
2024-10-10 00:44:00;5002;26;Bellecour;265;ASCENSEUR;mezzanine sur quai ligne D;2024-10-10;Panne;Pour accès et correspondances métros A et D, utiliser les autres ascenseurs en passant par la surface;2024-10-10 02:30:00
2024-10-10 00:44:00;5002;26;Bellecour;2607;ESCALIER;du quai central jusqu'à la mezzanine sud (côté Antonin Poncet);2024-10-10;Panne;.;2024-10-10 02:30:00
2024-10-10 00:44:00;5002;26;Bellecour;2612;ESCALIER;du quai direction Vaulx-en-Velin La Soie jusqu'à la sortie place Bellecour;2024-07-25;Panne;.;2024-12-08 14:30:00
2024-10-10 00:44:00;5103;84;Gare de Vaise;8402;ESCALIER;sortie rue du 24 mars 1852.;2024-10-10;Panne;.;2024-10-10 02:30:00
2024-10-10 00:44:00;5181;77;Garibaldi;772;ASCENSEUR;direction  Gare de Vénissieux, correspondance avec le quai direction Gare de Vaise, accès cours Albert Thomas;2024-10-10;Panne;Station inaccessible ;2024-10-10 02:30:00
2024-10-10 00:44:00;5041;74;Grange Blanche;7406;ESCALIER;de la mezzanine jusqu'à la sortie place d' Arsonval (départ bus);2024-09-06;Entretien programmé;.;2024-11-06 13:30:00
2024-10-10 00:44:00;5044;79;Guillotière Gabriel Péri;793;ASCENSEUR;correspondance entre la mezzanine et la Grande rue de la Guillotière;2024-10-09;Panne; Accès station impossible;2024-10-10 17:30:00
2024-10-10 00:44:00;5084;71;Parilly;7102;ESCALIER;du quai direction Gare de Vénissieux jusqu'à la sortie rue du Marché;2024-10-09;Panne;.;2024-10-10 01:00:00
2024-10-10 00:44:00;5095;81;Vieux Lyon;8107;ESCALIER;de la mezzanine niveau -3 (correspondance ligne D direction Gare de Vaise ou Gare de Vénissieux) jusqu'à la mezzanine niveau Point Contact, accès rue du Doyenné.;2023-12-30;Panne;.;2024-12-01 22:00:00
2024-10-10 00:44:00;5045;58;Hénon;581;ASCENSEUR;direction Cuire, accès Bd des Canuts;2024-10-10;Panne;Accès impossible direction Cuire;2024-10-10 02:30:00
2024-10-10 00:44:00;5000;27;Ampère Victor Hugo;2702;ESCALIER;du quai direction Vaulx-en-Velin La Soie  jusqu'à la sortie rue Victor HUGO;2024-10-08;Panne;.;2024-10-10 21:30:00
2024-10-10 00:44:00;5023;17;Cusset;172;ASCENSEUR;du quai direction Vaulx-en-Velin La Soie jusqu'à la mezzanine et accès cours Emile Zola;2024-10-10;Panne;Accès impossible direction Vaulx-en-Velin La Soie;2024-10-10 02:30:00
2024-10-10 00:44:00;5024;18;Flachet;182;ASCENSEUR;direction Vaulx-en-Velin La Soie, accès cours Emile Zola;2024-10-10;Panne;Accès impossible direction Vaulx-en-Velin La Soie;2024-10-10 02:30:00
2024-10-10 00:44:00;5024;18;Flachet;1802;ESCALIER;du quai direction Vaulx-en-Velin La Soie jusqu'à la sortie cours Emile Zola;2024-09-11;Panne;.;2024-10-18 23:30:00
2024-10-10 00:44:00;5042;19;Gratte Ciel;192;ASCENSEUR;du quai direction Vaulx-en-Velin La Soie, accès cours Emile Zola;2024-10-10;Panne;Accès impossible direction Vaulx-en-Velin La Soie;2024-10-10 02:30:00
2024-10-10 00:44:00;5042;19;Gratte Ciel;1902;ESCALIER;du quai direction Vaulx-en-Velin La Soie jusqu'à la sortie square Henri Bertrand;2024-10-10;Panne;.;2024-10-10 02:30:00
2024-10-10 00:44:00;5101;16;Laurent Bonnevay;169;ASCENSEUR;Parc Relais;2024-10-10;Panne;Accès aux différents niveaux impossible;2024-10-10 02:30:00
2024-10-10 00:44:00;5101;16;Laurent Bonnevay;1601;ESCALIER;de la mezzanine piéton jusqu'au quai de départ de la ligne A direction Perrache;2024-10-08;Panne;.;2024-10-18 21:30:00
2024-10-10 00:44:00;5101;16;Laurent Bonnevay;1602;ESCALIER;de la passerelle piéton, venant de la gare routière bus, jusqu'à la mezzanine piéton;2024-10-10;Panne;.;2024-10-10 02:30:00
2024-10-10 00:44:00;5081;22;Masséna;221;ASCENSEUR;direction Perrache et accès cours Vitton;2024-10-08;Panne;Accès impossible direction Perrache;2024-11-08 17:00:00
2024-10-10 00:44:00;5183;20;République Villeurbanne;202;ASCENSEUR;du quai direction Vaulx-en-Velin La Soie, accès cours Emile Zola;2024-10-10;Panne;Accès impossible direction Vaulx-en-Velin La Soie;2024-10-10 02:30:00
2024-10-10 00:44:00;5564;15;Vaulx-en-Velin La Soie;152;ASCENSEUR;correspondance entre le quai d'arrivée et la Gare Routière;2024-10-10;Panne;Accès impossible à la Gare Routière;2024-10-10 02:30:00
