Date màj;Code lieu;Code station;Nom station;Code équipement;Type équipement;Equipement;Début indispo;Cause;Conséquence;Fin indispo
2025-01-04 13:49:00;5220;47;Debourg;472;ASCENSEUR;direction Charpennes et accès avenue Jean Jaurès;2024-12-31;Panne; Accès impossible direction Charpennes;2025-02-01 21:30:00
2025-01-04 13:49:00;5220;47;Debourg;4702;ESCALIER;du quai direction Charpennes jusqu'à la sortie avenue Jean Jaures;2024-11-12;Panne;.;2025-02-01 07:30:00
2025-01-04 13:49:00;5520;42;Gare Part-Dieu V.Merle;4207;ESCALIER;de la mezzanine niveau Point Contact jusqu'au quai direction St-Genis-Laval Hôpital Lyon Sud (par couloir de liaison);2025-01-03;Panne;.;2025-01-04 21:30:00
2025-01-04 13:49:00;5520;42;Gare Part-Dieu V.Merle;4210;ESCALIER;de la sortie de la gare de la Part Dieu jusqu'à la mezzanine niveau Point Contact (par couloir de liaison);2024-10-28;Panne;.;2025-01-31 12:30:00
2025-01-04 13:49:00;5160;45;Jean Macé;4502;ESCALIER;Place Jean Macé face, à la rue Professeur Grignard;2024-09-18;Panne;.;2025-01-31 23:30:00
2025-01-04 13:49:00;5043;43;Place Guichard;431;ASCENSEUR;direction St-Genis-Laval Hôpital Lyon Sud et accès place Guichard;2024-12-24;Panne;Accès impossible direction Gare d'Oullins;2025-02-28 23:30:00
2025-01-04 13:49:00;5221;46;Place Jean Jaurès;4601;ESCALIER;du quai direction St-Genis-Laval Hôpital Lyon Sud jusqu'à la sortie avenue Jean Jaures;2024-10-09;Panne;.;2025-01-31 21:00:00
2025-01-04 13:49:00;5221;46;Place Jean Jaurès;4602;ESCALIER;du quai direction Charpennes jusqu'à la sortie avenue Jean Jaures;2024-11-02;Panne;.;2025-01-31 22:30:00
2025-01-04 13:49:00;5092;44;Saxe - Gambetta;4405;ESCALIER;de la mezzanine nord (niveau ligne D direction Gare de Vaise) jusqu'à la sortie angle avenue Jean Jaurès / avenue de Saxe;2025-01-02;Panne;.;2025-01-04 23:30:00
2025-01-04 13:49:00;5200;48;Stade de Gerland Le LOU;4802;ESCALIER;de la mezzanine niveau Point Contact jusqu'au quai direction Charpennes;2024-10-23;Panne;.;2025-01-31 11:30:00
2025-01-04 13:49:00;5002;26;Bellecour;2607;ESCALIER;du quai central jusqu'à la mezzanine sud (côté Antonin Poncet);2025-01-04;Accès fermé pour travaux;.;2025-01-04 16:00:00
2025-01-04 13:49:00;5103;84;Gare de Vaise;8404;ESCALIER;de la mezzanine nord jusqu'à la Gare Routière;2025-01-04;Panne;.;2025-01-04 16:00:00
2025-01-04 13:49:00;5104;70;Gare de Vénissieux;7003;ESCALIER;de la mezzanine vers la passerelle SNCF;2024-12-12;Panne;.;2025-01-15 15:30:00
2025-01-04 13:49:00;5181;77;Garibaldi;7702;ESCALIER;du quai direction Gare de Vénissieux jusqu'à la mezzanine;2024-11-17;Entretien programmé;.;2025-01-10 12:30:00
2025-01-04 13:49:00;5181;77;Garibaldi;7703;ESCALIER;de la mezzanine jusqu'à la sortie rue Garibaldi;2025-01-04;Accès fermé pour travaux;.;2025-01-04 16:00:00
2025-01-04 13:49:00;5181;77;Garibaldi;7704;ESCALIER;de la mezzanine jusqu'à la sortie cours Gambetta;2025-01-02;Entretien programmé;.;2025-01-12 08:00:00
2025-01-04 13:49:00;5040;82;Gorge de Loup;821;ASCENSEUR;direction Gare de Vaise, accès Gare Routière ou Parc Relais;2025-01-02;Panne;Accès impossible direction Gare de Vaise.;2025-01-15 20:30:00
2025-01-04 13:49:00;5040;82;Gorge de Loup;8205;ESCALIER;sortie Place Basse (côté agence commerciale) niveau Parc Relais, jusqu'à la mezzanine niveau départ gare de bus, rue Sergent Michel Berthet;2024-12-12;Panne;.;2025-01-10 15:00:00
2025-01-04 13:49:00;5041;74;Grange Blanche;7401;ESCALIER;de place d'Arsonval (descente de bus) jusqu'à la mezzanine face à la croissanterie;2024-12-16;Entretien programmé;.;2025-01-05 15:30:00
2025-01-04 13:49:00;5041;74;Grange Blanche;7402;ESCALIER;de la mezzanine côté hôpital Edouard Herriot jusqu'à la sortie Hôpital Edouard Herriot;2024-12-13;Panne;.;2025-01-31 07:30:00
2025-01-04 13:49:00;5044;79;Guillotière Gabriel Péri;792;ASCENSEUR;direction Gare de Vénissieux, correspondance quai direction Gare de Vaise;2025-01-04;Accès fermé pour travaux; Accès impossible direction Gare de Vénissieux;2025-01-04 16:00:00
2025-01-04 13:49:00;5044;79;Guillotière Gabriel Péri;7901;ESCALIER;de la mezzanine (côté quai direction Gare de Vaise) jusqu'à la sortie cours Gambetta;2025-01-04;Panne;.;2025-01-04 16:00:00
2025-01-04 13:49:00;5044;79;Guillotière Gabriel Péri;7902;ESCALIER;de la mezzanine (côté quai direction Gare de Vénissieux) jusqu'à la sortie cours Gambetta;2024-12-12;Entretien programmé;.;2025-01-05 12:30:00
2025-01-04 13:49:00;5062;73;Laennec;7302;ESCALIER;du quai direction Gare de Vénissieux jusqu'à la sortie rue Guillaume Paradin;2024-12-11;Entretien programmé;.;2025-01-05 11:00:00
2025-01-04 13:49:00;5082;72;Mermoz - Pinel;7201;ESCALIER;du quai direction Gare de Vaise jusqu'à la mezzanine;2024-12-13;Entretien programmé;.;2025-01-05 13:00:00
2025-01-04 13:49:00;5083;75;Monplaisir Lumière;752;ASCENSEUR;direction Gare de Vénissieux, accès cours Albert Thomas;2025-01-01;Panne; Accès impossible direction Gare de Vénissieux;2025-01-05 22:00:00
2025-01-04 13:49:00;5083;75;Monplaisir Lumière;7501;ESCALIER;du quai direction Gare de Vaise jusqu'à la sortie place Ambroise Courtois;2024-12-16;Entretien programmé;.;2025-01-15 18:30:00
2025-01-04 13:49:00;5091;76;Sans Souci;7601;ESCALIER;du quai direction gare de Vaise jusqu'à la sortie rue des Tuiliers / cours Albert Thomas;2024-12-17;Entretien programmé;.;2025-12-05 15:30:00
2025-01-04 13:49:00;5091;76;Sans Souci;7602;ESCALIER;du quai direction Gare de Vénissieux jusqu'à la sortie cours Albert Thomas;2024-12-17;Panne;.;2025-01-31 19:00:00
2025-01-04 13:49:00;5095;81;Vieux Lyon;8107;ESCALIER;de la mezzanine niveau -3 (correspondance ligne D direction Gare de Vaise ou Gare de Vénissieux) jusqu'à la mezzanine niveau Point Contact, accès rue du Doyenné.;2024-12-07;Panne;.;2025-02-28 15:00:00
2025-01-04 13:49:00;5000;27;Ampère Victor Hugo;271;ASCENSEUR;direction Perrache, accès rue Victor Hugo;2025-01-04;Panne;Accès impossible direction Perrache;2025-01-04 15:30:00
2025-01-04 13:49:00;5042;19;Gratte Ciel;191;ASCENSEUR;du quai direction Perrache, accès cours Emile Zola;2024-12-29;Panne;Accès impossible direction Perrache;2025-01-15 16:30:00
2025-01-04 13:49:00;5101;16;Laurent Bonnevay;162;ASCENSEUR;du quai direction Vaulx-en-Velin La Soie, accès à la mezzanine;2024-12-30;Panne;Accès impossible au quai direction Vaulx-en-Velin La Soie;2025-01-10 20:30:00
