Date màj;Code lieu;Code station;Nom station;Code équipement;Type équipement;Equipement;Début indispo;Cause;Conséquence;Fin indispo
2025-04-11 02:19:00;5102;21;Charpennes;2103;ESCALIER;du quai direction St-Genis-Laval Hôpital Lyon Sud jusqu'à la place Charles Hernu;2025-04-10;Panne;.;2025-04-11 17:30:00
2025-04-11 02:19:00;5220;47;Debourg;4701;ESCALIER;du quai direction St-Genis-Laval Hôpital Lyon Sud jusqu'à la sortie avenue Jean Jaures;2025-01-21;Panne;.;2025-05-30 17:30:00
2025-04-11 02:19:00;5520;42;Gare Part-Dieu V.Merle;4210;ESCALIER;de la sortie de la gare de la Part Dieu jusqu'à la mezzanine niveau Point Contact (par couloir de liaison);2025-03-27;Panne;.;2025-04-25 17:30:00
2025-04-11 02:19:00;5160;45;Jean Macé;4501;ESCALIER;du quai direction St-Genis-Laval Hôpital Lyon Sud jusqu'à la sortie place Jean Macé (côté rue Parmentier);2025-03-20;Panne;.;2025-04-13 17:30:00
2025-04-11 02:19:00;5936;51;Oullins Centre;513;ASCENSEUR;entre la mezzanine supérieure et la place Anatole France;2025-04-11;Panne;connexion impossible entre la mezzanine supérieure et la place Anatole France, et correspondance impossible avec les ascenseurs reliant les quais et la mezzanine supérieure;2025-04-11 03:00:00
2025-04-11 02:19:00;5043;43;Place Guichard;431;ASCENSEUR;direction St-Genis-Laval Hôpital Lyon Sud et accès place Guichard;2025-04-11;Panne;Accès impossible direction Gare d'Oullins;2025-04-11 02:30:00
2025-04-11 02:19:00;5221;46;Place Jean Jaurès;461;ASCENSEUR;direction St-Genis-Laval Hôpital Lyon Sud et accès avenue Jean Jaurès;2025-04-09;Panne;Accès impossible direction Gare d'Oullins;2025-04-17 19:30:00
2025-04-11 02:19:00;5221;46;Place Jean Jaurès;462;ASCENSEUR;direction Charpennes et accès avenue Jean Jaurès;2025-03-25;Panne; Accès impossible direction Charpennes;2025-05-31 17:30:00
2025-04-11 02:19:00;5221;46;Place Jean Jaurès;4601;ESCALIER;du quai direction St-Genis-Laval Hôpital Lyon Sud jusqu'à la sortie avenue Jean Jaures;2025-04-10;Panne;.;2025-04-17 17:30:00
2025-04-11 02:19:00;5221;46;Place Jean Jaurès;4602;ESCALIER;du quai direction Charpennes jusqu'à la sortie avenue Jean Jaures;2025-03-25;Panne;.;2025-04-17 17:30:00
2025-04-11 02:19:00;5092;44;Saxe - Gambetta;4404;ESCALIER;du quai direction Charpennes jusqu'à la mezzanine sud (niveau sortie avenue Jean Jaurès);2025-04-09;Panne;.;2025-05-31 17:30:00
2025-04-11 02:19:00;5092;44;Saxe - Gambetta;4403;ESCALIER;du quai direction St-Genis-Laval Hôpital Lyon Sud jusqu'à la mezzanine sud (niveau sortie avenue Jean Jaurès);2025-04-09;Panne;.;2025-05-31 17:30:00
2025-04-11 02:19:00;5092;44;Saxe - Gambetta;4401;ESCALIER;du quai direction St-Genis-Laval Hôpital Lyon Sud jusqu'à la mezzanine nord (niveau ligne D direction Gare de Vaise);2025-04-08;Panne;.;2025-04-30 14:30:00
2025-04-11 02:19:00;5092;44;Saxe - Gambetta;4405;ESCALIER;de la mezzanine nord (niveau ligne D direction Gare de Vaise) jusqu'à la sortie angle avenue Jean Jaurès / avenue de Saxe;2025-04-07;Panne;.;2025-04-15 15:00:00
2025-04-11 02:19:00;5092;44;Saxe - Gambetta;4406;ESCALIER;de la mezzanine sud  jusqu'à la sortie avenue Jean Jaurès;2025-04-09;Panne;.;2025-05-31 17:30:00
2025-04-11 02:19:00;5200;48;Stade de Gerland Le LOU;481;ASCENSEUR;correspondance entre le quai direction St-Genis-Laval Hôpital Lyon Sud et la mezzanine;2025-04-10;Panne;Accès impossible direction Gare d'Oullins;2025-05-10 17:30:00
2025-04-11 02:19:00;5200;48;Stade de Gerland Le LOU;483;ASCENSEUR;correspondance entre la mezzanine et l'avenue Jean Jaurès;2025-04-05;Panne; Accès station impossible;2025-05-31 20:30:00
2025-04-11 02:19:00;5200;48;Stade de Gerland Le LOU;4802;ESCALIER;de la mezzanine niveau Point Contact jusqu'au quai direction Charpennes;2025-03-02;Panne;.;2025-04-30 17:30:00
2025-04-11 02:19:00;5200;48;Stade de Gerland Le LOU;4803;ESCALIER;de la mezzanine niveau Point Contact jusqu'à la sortie avenue Jean Jaurès;2025-04-06;Panne;.;2025-04-11 19:30:00
2025-04-11 02:19:00;5002;26;Bellecour;2601;ESCALIER;du quai direction Vaulx-en-Velin La Soie jusqu'à la sortie place Bellecour;2025-02-11;Panne;.;2025-04-30 19:30:00
2025-04-11 02:19:00;5002;26;Bellecour;2603;ESCALIER;du by-pass de correspondance ligne D / ligne A jusqu'au quai ligne A direction Vaulx-en-Velin La Soie;2025-02-05;Entretien programmé;.;2025-04-30 15:30:00
2025-04-11 02:19:00;5002;26;Bellecour;2608;ESCALIER;de la mezzanine sud (côté Antonin Poncet) jusqu'à la sortie place Antonin Poncet (face à la Poste);2025-02-11;Entretien programmé;.;2025-04-30 11:00:00
2025-04-11 02:19:00;5002;26;Bellecour;2606;ESCALIER;du quai central jusqu'à la mezzanine sud (côté Antonin Poncet);2025-02-11;Panne;.;2025-04-30 19:30:00
2025-04-11 02:19:00;5104;70;Gare de Vénissieux;7001;ESCALIER;de la mezzanine vers le quai de départ direction Gare de Vaise;2025-04-08;Entretien programmé;.;2025-04-15 12:00:00
2025-04-11 02:19:00;5181;77;Garibaldi;772;ASCENSEUR;direction  Gare de Vénissieux, correspondance avec le quai direction Gare de Vaise, accès cours Albert Thomas;2025-04-10;Panne;Station inaccessible ;2025-04-11 20:00:00
2025-04-11 02:19:00;5181;77;Garibaldi;7701;ESCALIER;du quai direction Gare de Vaise jusqu'à la mezzanine;2025-02-05;Panne;.;2025-04-30 14:30:00
2025-04-11 02:19:00;5181;77;Garibaldi;7702;ESCALIER;du quai direction Gare de Vénissieux jusqu'à la mezzanine;2024-11-17;Entretien programmé;.;2025-05-31 20:30:00
2025-04-11 02:19:00;5040;82;Gorge de Loup;821;ASCENSEUR;direction Gare de Vaise, accès Gare Routière ou Parc Relais;2025-04-09;Panne;Accès impossible direction Gare de Vaise.;2025-04-12 22:30:00
2025-04-11 02:19:00;5040;82;Gorge de Loup;822;ASCENSEUR;direction Gare de Vénissieux, correspondance quai direction Gare de Vaise, accès Gare Routière ou Gare SNCF et rue Sergent Michel Berthet;2025-03-28;Entretien programmé;Accès impossible direction Gare de Vénissieux;2025-04-13 16:30:00
2025-04-11 02:19:00;5040;82;Gorge de Loup;8205;ESCALIER;sortie Place Basse (côté agence commerciale) niveau Parc Relais, jusqu'à la mezzanine niveau départ gare de bus, rue Sergent Michel Berthet;2025-03-21;Panne;.;2025-05-10 10:30:00
2025-04-11 02:19:00;5041;74;Grange Blanche;7406;ESCALIER;de la mezzanine jusqu'à la sortie place d' Arsonval (départ bus);2025-04-08;Entretien programmé;.;2025-04-23 15:30:00
2025-04-11 02:19:00;5041;74;Grange Blanche;7402;ESCALIER;de la mezzanine côté hôpital Edouard Herriot jusqu'à la sortie Hôpital Edouard Herriot;2024-12-13;Panne;.;2025-05-30 07:30:00
2025-04-11 02:19:00;5041;74;Grange Blanche;7401;ESCALIER;de place d'Arsonval (descente de bus) jusqu'à la mezzanine face à la croissanterie;2025-03-18;Entretien programmé;.;2025-04-13 16:00:00
2025-04-11 02:19:00;5044;79;Guillotière Gabriel Péri;7901;ESCALIER;de la mezzanine (côté quai direction Gare de Vaise) jusqu'à la sortie cours Gambetta;2025-04-05;Panne;.;2025-04-13 16:30:00
2025-04-11 02:19:00;5044;79;Guillotière Gabriel Péri;7904;ESCALIER;du quai direction Gare de Vénissieux jusqu'à la mezzanine;2025-03-27;Panne;.;2025-04-13 15:30:00
2025-04-11 02:19:00;5062;73;Laennec;7301;ESCALIER;du quai direction Gare de Vaise jusqu'à la sortie rue Guillaume Paradin;2025-02-25;Entretien programmé;.;2025-05-15 19:30:00
2025-04-11 02:19:00;5062;73;Laennec;7302;ESCALIER;du quai direction Gare de Vénissieux jusqu'à la sortie rue Guillaume Paradin;2025-04-04;Entretien programmé;.;2025-05-15 18:00:00
2025-04-11 02:19:00;5083;75;Monplaisir Lumière;7502;ESCALIER;du quai direction Gare de Vénissieux jusqu'à la sortie cours Albert Thomas;2025-01-13;Entretien programmé;.;2025-05-30 09:30:00
2025-04-11 02:19:00;5091;76;Sans Souci;7602;ESCALIER;du quai direction Gare de Vénissieux jusqu'à la sortie cours Albert Thomas;2025-04-04;Entretien programmé;.;2025-05-30 18:00:00
2025-04-11 02:19:00;5094;83;Valmy;8302;ESCALIER;de la mezzanine jusqu'à la sortie place Valmy;2025-04-04;Entretien programmé;.;2025-06-30 18:00:00
2025-04-11 02:19:00;5046;24;Hôtel de Ville L. Pradel;2402;ESCALIER;du quai de descente ligne C jusqu'au quai ligne A direction Perrache;2025-04-11;Panne;.;2025-04-11 02:30:00
2025-04-11 02:19:00;5002;26;Bellecour;261;ASCENSEUR;direction Vaulx-en-Velin La Soie, correspondance ligne A direction Perrache et  ligne D, direction Gare de Vénissieux ou Gare de Vaise;2025-03-19;Panne;Pour correspondance ligne A direction Perrache et ligne D directions Gare de Vénissieux ou Gare de Vaise, utiliser les autres ascenseurs en passant par la surface;2025-04-30 14:30:00
2025-04-11 02:19:00;5023;17;Cusset;171;ASCENSEUR;direction Perrache, accès mezzanine de correspondance direction Vaulx-en-Velin La Soie, accès cours Emile Zola;2025-03-31;Panne;Accès impossible direction Perrache.  Accès impossible cours Emile Zola .;2025-04-27 17:30:00
2025-04-11 02:19:00;5024;18;Flachet;182;ASCENSEUR;direction Vaulx-en-Velin La Soie, accès cours Emile Zola;2025-02-03;Panne;Accès impossible direction Vaulx-en-Velin La Soie;2025-04-30 17:30:00
2025-04-11 02:19:00;5024;18;Flachet;1801;ESCALIER;du quai direction Perrache jusqu'à la sortie cours Emile Zola;2025-04-07;Panne;.;2025-04-21 17:30:00
2025-04-11 02:19:00;5182;23;Foch;2301;ESCALIER;du quai direction Perrache jusqu'à la sortie angle cours Franklin Roosevelt / avenue du Maréchal de Saxe;2025-04-10;Panne;.;2025-04-24 17:30:00
2025-04-11 02:19:00;5101;16;Laurent Bonnevay;1601;ESCALIER;de la mezzanine piéton jusqu'au quai de départ de la ligne A direction Perrache;2025-04-08;Panne;.;2025-04-15 17:30:00
2025-04-11 02:19:00;5564;15;Vaulx-en-Velin La Soie;152;ASCENSEUR;correspondance entre le quai d'arrivée et la Gare Routière;2025-04-02;Panne;Accès impossible à la Gare Routière;2025-04-20 23:30:00
